{"id":"if_n10000_K4_low_moderate_well_loose_s0","data_ref":"gen:instance_family?n=10000&K=4&card=low&skew=moderate&cond=well&infeas=loose&seed=0","margins":["m1","m2","m3","m4"],"targets":{"m1":{"c1":0.48,"c2":0.24,"c3":0.16,"c4":0.12},"m2":{"c1":0.48,"c2":0.24,"c3":0.16,"c4":0.12},"m3":{"c1":0.48,"c2":0.24,"c3":0.16,"c4":0.12},"m4":{"c1":0.48,"c2":0.24,"c3":0.16,"c4":0.12}},"bounds":{"min":0,"max":null},"tol":1e-08,"objective_families":["kl","chi2","logit","minimax"],"K":4}
