{"id":"if_n1000_K2_high_extreme_ill_tight_s0","data_ref":"gen:instance_family?n=1000&K=2&card=high&skew=extreme&cond=ill&infeas=tight&seed=0","margins":["m1","m2"],"targets":{"m1":{"c1":0.8331791683015,"c2":0.1041473960377,"c3":0.03085848771487,"c4":0.01301842450471,"c5":0.006665433346412,"c6":0.003857310964359,"c7":0.002429093785135,"c8":0.001627303063089,"c9":0.001142906952403,"c10":0.0008331791683015,"c11":0.0006259798409478,"c12":0.0004821638705448,"c13":0.0003792349423311,"c14":0.0003036367231419,"c15":0.000246867901719,"c16":0.0002034128828861},"m2":{"c1":0.8331791683015,"c2":0.1041473960377,"c3":0.03085848771487,"c4":0.01301842450471,"c5":0.006665433346412,"c6":0.003857310964359,"c7":0.002429093785135,"c8":0.001627303063089,"c9":0.001142906952403,"c10":0.0008331791683015,"c11":0.0006259798409478,"c12":0.0004821638705448,"c13":0.0003792349423311,"c14":0.0003036367231419,"c15":0.000246867901719,"c16":0.0002034128828861}},"bounds":{"min":0,"max":1.05},"tol":1e-08,"objective_families":["kl","chi2","logit","minimax"],"K":2}
