{"id":"if_n1000_K2_medium_moderate_well_loose_s0","data_ref":"gen:instance_family?n=1000&K=2&card=medium&skew=moderate&cond=well&infeas=loose&seed=0","margins":["m1","m2"],"targets":{"m1":{"c1":0.3679369250986,"c2":0.1839684625493,"c3":0.1226456416995,"c4":0.09198423127464,"c5":0.07358738501971,"c6":0.06132282084976,"c7":0.05256241787122,"c8":0.04599211563732},"m2":{"c1":0.3679369250986,"c2":0.1839684625493,"c3":0.1226456416995,"c4":0.09198423127464,"c5":0.07358738501971,"c6":0.06132282084976,"c7":0.05256241787122,"c8":0.04599211563732}},"bounds":{"min":0,"max":null},"tol":1e-08,"objective_families":["kl","chi2","logit","minimax"],"K":2}
