{"id":"if_n10000_K4_medium_moderate_well_tight_s0","data_ref":"gen:instance_family?n=10000&K=4&card=medium&skew=moderate&cond=well&infeas=tight&seed=0","margins":["m1","m2","m3","m4"],"targets":{"m1":{"c1":0.3679369250986,"c2":0.1839684625493,"c3":0.1226456416995,"c4":0.09198423127464,"c5":0.07358738501971,"c6":0.06132282084976,"c7":0.05256241787122,"c8":0.04599211563732},"m2":{"c1":0.3679369250986,"c2":0.1839684625493,"c3":0.1226456416995,"c4":0.09198423127464,"c5":0.07358738501971,"c6":0.06132282084976,"c7":0.05256241787122,"c8":0.04599211563732},"m3":{"c1":0.3679369250986,"c2":0.1839684625493,"c3":0.1226456416995,"c4":0.09198423127464,"c5":0.07358738501971,"c6":0.06132282084976,"c7":0.05256241787122,"c8":0.04599211563732},"m4":{"c1":0.3679369250986,"c2":0.1839684625493,"c3":0.1226456416995,"c4":0.09198423127464,"c5":0.07358738501971,"c6":0.06132282084976,"c7":0.05256241787122,"c8":0.04599211563732}},"bounds":{"min":0,"max":1.05},"tol":1e-08,"objective_families":["kl","chi2","logit","minimax"],"K":4}
