{"id":"if_n10000_K4_medium_none_well_loose_s0","data_ref":"gen:instance_family?n=10000&K=4&card=medium&skew=none&cond=well&infeas=loose&seed=0","margins":["m1","m2","m3","m4"],"targets":{"m1":{"c1":0.125,"c2":0.125,"c3":0.125,"c4":0.125,"c5":0.125,"c6":0.125,"c7":0.125,"c8":0.125},"m2":{"c1":0.125,"c2":0.125,"c3":0.125,"c4":0.125,"c5":0.125,"c6":0.125,"c7":0.125,"c8":0.125},"m3":{"c1":0.125,"c2":0.125,"c3":0.125,"c4":0.125,"c5":0.125,"c6":0.125,"c7":0.125,"c8":0.125},"m4":{"c1":0.125,"c2":0.125,"c3":0.125,"c4":0.125,"c5":0.125,"c6":0.125,"c7":0.125,"c8":0.125}},"bounds":{"min":0,"max":null},"tol":1e-08,"objective_families":["kl","chi2","logit","minimax"],"K":4}
